neutral, What said
positive, Kurt and the crew on were amazing today They made my son's birthday with their kindness Hope to fly with them again soon
negative, Been on hold on the phone for well over half an waiting to make a reservation change I to make online Help
negative, had to wait on plane from Ottawa that never came Now I'm back home and have to try again tomorrow Suitcase still lost
negative, i'm glad u can solve the prob But my experience remains will not fly again on
negative, u Cancelled Flighted my flight from IAD to JAX Was supposed to use plane from BNA but u used that plane for another destination instead
negative, appreciate the early arrival of but any chance ORD will ever bring the bags out
neutral, it is possible to make a ticket change via Twitter Traveling internationally and can't make calls Thanks in advance
negative, A broken luggage and a mild case of food poisoning from Who can I email about this
negative, just filled it out Hope someone responds before we book our next trip
negative, friends been sitting in Houston since flight Cancelled FlightedStill don't have any answers
negative, meant changed planes i hate seating over wing if u wanted I would have booked it u will get formal complaint
neutral, give me an email address and I'll send the actually screen shot to you
negative, u guys did it again changed ages and double booked seats so I had to I've even though I have platinum and the other person none
neutral, also checked email you have on file for me and it is correct
negative, before and this time have checked mail just in
negative, sloppy stuff you don't see anymore united has raised my expectations this team was poor
negative, how long does it take to get a response from your customer service about a complaint done through email
negative, no bag led to many people backing up the aisle to front with bags
negative, cabin crew were huge stood as a conversational cluster blocking exiting passengers
negative, allowing passengers on my flight to block exit of plane
negative, no wheelchairs
negative, no commitment to a good an operations mgr would have counted a dozen small issues with individual performance
negative, the nightmare continues
negative, this team added mins on turnaround
positive, as a million miler with and flying almost every week I observe gate and flight crews committed to good operations
negative, call wait times are over minutes and airport wait times are longer
positive, we did
negative, I've been waiting for four hours and no one has been able to help me
positive, thank you for compensating us for our lost bags We will fly with you again
negative, we are sitting on the runway for hours It is ridiculous
negative, your service here pretty much ruined my but thanks for the weak attempt
negative, you forgot to tell them the flight was coming Thanks for allowing me to miss my connection
negative, Such as toothpaste Seems like that would be limited to correct
negative, Why was I forced to check my rollaboard on UA Plenty of room in the overhead next to my seat
negative, please don't take my membership away
negative, Please get me an economy plus seat Awful day of Cancelled Flighted after lots of planning
negative, has me NOT to hold to speak to an agent that doesn't understand the concept of time thanks
neutral, YAAYY YAY PROM
negative, but your system gave my seat awaynow I'm Economy Not Econ seat How did you give my plus seat away
positive, I JUST ASKED MY BOYFRIEND TO PROM OVER THE LOUDSPEAKER ON FLIGHT HE SAID YES BEST DAY EVER THANK U SO MUCH
negative, that no case id numbers just tried it screen that you for submitting your
negative, please You moved my seats and lost my upgrade I had seat I have a ticket in my hand for
positive, So appreciated
positive, Hmmmseems like this could be something to be changed to be more
positive, No problem just follow me back so I can Thank you
negative, any help is appreciated That's a LOOONG wait for help on something that's not his fault
negative, my husband is supposed to fly RDU to IAD then IAD to FRA leaving in hours You Cancelled Flighted his flight and there's a wait on phone
negative, is probably the least satisfactory airline I've ever been on Never fails to disappoint
positive, this flight has been amazing This is the best flight I have ever been on I am not kidding Service is INCREDIBLE
negative, not sure why u call it customer care Should be customer we don't care
negative, who is in charge of making decisions over there Cancelled Flightling flight was unacceptable I should be in right now
negative, I fly normally This doesn't happen to me with them I'll let your flyers provide their own feedback Thank you
positive, the upgrade to first class was a nice way to fix your earlier mistake Thank you
negative, how about plowing the snow at a gate before the plane arrives so we don't sit for minutes after an hr flight Fail
neutral, SATURDAY this morning Man dies from Ebola
positive, Rhonda C at Atlanta airport redeemed you guys She got us straightened out
negative, ok so what is being done about my experience My family had a terrible experience for It's kind of like being robbedExplain
negative, great job losing one of my six bags on a direct flight Don't know how you manage to do it
negative, the worst customer service in Denver
negative, ruined my day start trip SFO to GIG both legs lost my paid upgrade class seat moved me from Econ to Econ
neutral, So what's allowed or what's not allowed to be carried in my checked baggage
negative, now been on board with no movement for minwow this experience just keeps getting worse and worse
negative, have an employee at the gate before boarding like u expect ur customers to Be a competent company like ur rivals
negative, No wonder the cabin is filthy
negative, And then when we asked the stewardess to take the disinfectant wipe as trash she not with my hands
negative, I need to be a better airline
negative, flight was Cancelled Flightled due to mechanical issues but when I ask for cab fare they say it was weather and can't help me
neutral, I haven't booked I'm asking before I book
positive, Hi looks like my connection is delayed too so I'll make it Thanks
negative, I had my disinfectant wipes and did your job for you You're welcome
negative, You really should clean the food and coffee stains off of the area around the seats when new passengers come aboard Gross
positive, cldnt be happier w the many plastic wing pins given to me on flight I love them Amazing staff So nice
neutral, since UA is delayed pushing it into meal time does that mean it will be catered with meals in First
negative, help Invest more in your planes and your people and less in stock buybacks and executive pay Maybe then you would not disappoint
negative, ROC flight Cancelled Flightled Love my snowy drive home with no useful substitutes
neutral, correct What's correct Sorry I'm lost
negative, that's a crazy long form You need something other than a video
negative, I hope not to see the same issue on my return flight tomorrow
negative, flight just Cancelled Flightled This is ridiculous
neutral, I'm flying UA but with
negative, You shouldn't page o'head that it's best to call on hold mins
neutral, we have developers flying down tmrw morn min there is an earlier flight to have can move them up
positive, thanks for the reply If you can get me a better seat on my next leg to Munich That would be nice
negative, appreciate getting put on hold for and then getting hung up on because I was requesting help for big group I'll try
neutral, Home is Calgary can you get us there without the added expense of accommodations and meals
negative, thank you for your reply My frustration is that spending a upgrade just puts you on a wait list
negative, or your staff could try not throwing the luggage around
negative, of us are stranded And flying from New Orleans to Huston tonight and we will be stuck there for two days Rather fly than wait
negative, hello I am flying first class and am behind people on zone Pls pass on to app dept you should board class first
positive, thank you for taking care of my mom and reFlight Booking Problems her flight in phl
negative, can't get anyone to deal with me in person Cowardly customer I can't be looked in the eyes by anyone
negative, nope lost the seating preference I paid and here I still sit We'll see what happens my flight Late Flightr
negative, stuck in DC trying to get to Denver The engine shut down twice on us at the terminal Got any available flights for me
positive, Ill check it appreciate the regardless
neutral, nope no case id either time
negative, yes Cancelled Flightled Moved to I'll figure out car rental changes and such
negative, troubling time to raise the bar on legroom
positive, was phenomenal frm gate to gate
positive, Thanks Hopefully this is easily resolved
neutral, Gold So the international baggage limit apply when booked on for a domestic leg What if I travel with friends
negative, terrible travel experience Traveled miles roundtrip but two Cancelled Flightlations of short hops cost me two days
negative, why are you charging people to see the freaking flight map
negative, my flight from MCO has been delayed scheduled to arrive after my connection departs What options do I have
negative, is not a company that values it's customer after reading tweets to them I'm not the only one who feels that way
negative, I was disrespected and met with incompetence at every turn how about a voucher for a domestic round trip
negative, DAY to IAD and CVG to IAD both Cancelled Flightled by United but all other airlines operating Friend stuck and now miss intl flight Help
neutral, already DM you my concern Pls check
negative, well if you don't want your customers to be frustrated compensate them appropriately when you screw up royally
neutral, I'm I fly a lot Just sad I had to change my shoes ha
positive, I will Thanks
negative, employees are the group of people anywhere for Tasha at at
negative, But it's doubtful he'll fly United again and he will be traveling a lot as a sales manager covering all of North America
positive, They finally gave in a let him on After they threatened to send him back to Vegas on coach Thnx
negative, Worst customer for sure
negative, Worst airline ever
neutral, same flight number different flight I'm heading to MPLS
neutral, flights taking off from IAD this afternoon
neutral, I will I have to get to Bangkok I have just days to spend with my husband in his mid deployment leave Like to get there asap
negative, Just let the employees know that good service and a kind attitude towards customers is vital in this kind of business Thanks
neutral, and a husband
negative, need assistance Line is out the door and travelling with kids
negative, Friend at O'Hare and can't get on flight bc they say no proof he bought class tkt He has boarding pass
positive, gave me a smile with a Zero Award Computers have some sense of humour
negative, Right now at Tropic Air in San Line out the door All due to elected appointed hacks
neutral, I take it as a compliment that I was mistaken several times as a member of your staff on my flight time to remove my scarf
negative, Your new mileage policy is awful I might have paid slightly more for United because of miles Now there's no difference
negative, can anyone assure me that the aircraft coming to Denver had left it's previous destination Flight
negative, yes refund my ticket and give me email address to let u know what happened
negative, I would like speak VP of Jimmy Samartzis I sent a about my awful flight exp
negative, we are delayed in San Belize We are scheduled to fly out at from Belize City to Houston Will you wait please
negative, Hello United You should take care of your call center in Mexico City Office Terrible attitude from the lady who was helping me
negative, Great I'm guessing you were Late Flight to service is you're and don't care that everyone is miserable
neutral, I'm glad means lol
negative, UNBELIEVABLY DISAPPOINTED DELAY AFTER DELAY STOP MESSING WITH MY LIFE
negative, What a really GREAT FLATTERING story about you You should be very proud
neutral, I was able to get a seat on earlier flight sfo to ind Can you add me to ord to IND
negative, I'm on snowy roads to BWI I Just called MileagePlus told flight was Cancelled Flighted hours ago I rcvd no notification Pls help
negative, I interviewed yesterday as a flight attendant I was the last person the recruiter said they lost my file n came back to interview me
negative, remember in a pleasant means you will tell a friend A bad experience means you will tell everyone you see
negative, let me assure you my travel time is not
negative, U BUMS HOW DO U LOSE THE BIGGEST BAG ON THE FLIGHT
negative, is to airlines as is to
negative, customers Customer service
negative, great decision making skills flight ops IAH bag makes a minute connection and I flight pushed early Disappointed
negative, they fucked my flight The festivities are already in full swing at the United Fairway overlooking the hole
negative, in the process of purchasing when prices changed unbelievable
negative, I am stranded in Chicago O'Hare for another hours Any chance your service team could provide a meal
positive, All flights Cancelled Flighted Trip refunded without staff extremely no complaints Way to handle bad weather
negative, hours after landing in I still do not have my bagswhich means no clothes or makeup
negative, in the not ok Get gate agents work as a team against is never cool
negative, really fucked my day up Hilo to LAX delay because of software missed getting home Late Flightr no upgrade nothin
negative, send someone to the customer service counter in person DIA concourse B across from gate
negative, I'm not sure why I expected anyone to be here
negative, this is not true Gate agents caused this And we're not helpful Thanks for making me miss connection
neutral, Yes Luckily I was there
negative, it's my birthday and my sister is coming to celebrate but her flights keep Cancelled Flighting PLZ do all you can to get her here
negative, what's the hold up with flight from SLC to DEN
negative, flight tomorrow Cancelled Flighted Asked for overnight in Told not without paying That's wrong
neutral, can you please follow for a DM
positive, thank you for the help
negative, Yeah that didn't happen
negative, Why do I still not have my bags They arrived says they're still at the hours Late Flightr
negative, had a maintenance issue Stuck in Geneva with meal voucher that won't even cover a pLate Flight of spaghetti Really
negative, Hate when I get bumped out of the seat I've selected empty and moved to another seat
negative, no announcement re extra find an empty bin down to aisle back up with baggage to my seat row YOUR agents argueing
negative, bags arrived I sure miss the customer focused days when I used to fly Here's hoping wakes up
negative, Total BShave class seats for connecting flight Your crew Late Flight We miss connection Had next plane Yet u don't honor it
negative, too much info to share via tweet Please send me your name and contact info Happy to supply you with images and CS rep names
negative, once again your lack of customer service astounds me You are the worst airline in the history of airlines Train your staff
negative, Extremely disappointed in United left crew and pssgrs stranded in rain gate with no cover Left Psngrs depart plane
negative, besides landing the overall customer service experience has been poor Late Flight and rude workers plus missing luggage
neutral, I was just calling the Global Services help desk so via phone
neutral, on final Pls don't let my connection leave
negative, fuck and your shitty fucking information
positive, you're good Thank you
neutral, how much does a ski bag cost to check Bag contains pair is skis and one pair of poles
positive, Wasn't frustrating not in any way reLate Flightd to anyway Impressed that I made it
neutral, no thanks
neutral, I got it now Wouldn't let me log on with my email Thx Here's hoping for without issue today
positive, the router is on top of the fuselage
negative, on my seat appears to have had a mite problem Dr recently confirmed over bug bites were mites
negative, come reopen at ORD and clear your growing DC backlog
negative, customer delay coupon can only be redeemed on website which has higher prices than call wait time
negative, I'm strongly considering taking my business elsewhere
negative, your website won't allow me to post the required i keep getting having technical
neutral, lounge Used by
negative, really needs to start upgrading their planes No TVs then the inflight wifi is currently unavailable
negative, I am not digging the new mileage earning plan I would earn about of the miles I do now Any changes to the award ticket prices
negative, outsourcing ticket and gate agents at MIA Ill advised You did it in ROC and service went downhill Keep employees and fliers first
negative, Was just hung up on by customer service after waiting min on holdguess that vacation's not happening Website wasn't working
negative, bad idea to let people back on the terminal with food vouchers but allow only minutes to get anything Long lines
negative, what's going on with the mileage plus accounts Login through username and email have been down for at least three days
negative, what incentive do I have to give you another chance
neutral, my dad booked through orbitz and due to weather he can't make it to the airport Can you help him
negative, Finally I get the right response United must check this issue UA EWR to PUJ on Friday
neutral, to begin Heathrow route on May
negative, hours Late Flightr Last year hrs to San Diego and the no inflight entertainment
negative, lost bag in Huston we leave for a Bahamas cruise today from and had to buy all new stuff Customer service is non existent
negative, site errored out at last step of changing award Now can't even pull up reservation minute wait time Thanks
negative, you get a chance today as I fly to A'dam Let's see if you can redeem yourself after that last horrendous trip to the states
positive, Very impressed so far An app that's worth a damn and sms updates on my flight
neutral, any last minute flight deals for your cute little  my Friday flight was Cancelled Flightled
negative, just had the worst customer service experience ever on united airlines
negative, airlines only time I ever fly your airline What a disgrace I should've listened to your tweet
negative, diverged to Vermont This sucks
negative, officially has the most inefficient boarding procedure There is no reason it should take mins to board a plane
negative, hours of sitting in the plane that hasn't left the Gate yet more hours of actual flying left
negative, I sent my details to the customer care link you sent me almost a month ago and no response
negative, terrible service for military members and their families
neutral, Hi have a question re future Flight Booking Problems I'm What is checked bag allowance for
negative, My flight was Cancelled Flighted and I'm needing some help reFlight Booking Problems
negative, I just very surprised it took over mins Never experienced anything like that on number
neutral, taxies departing as to Newark Liberty Airport
negative, I'm afraid not I fly or service every week and I'm just unhappyspend too much money to be unhappy
positive, thank you It's my daughters bd party weather it doesn't look promising Please assist with earlier flts to Cmh
negative, if you're going to Cancelled Flight flights do everyone a favor and get on it now Don't stall the inevitable
negative, your plane's been waiting at the Gate for two hours with all passengers onboard in their cramped seats Yuck
negative, Flight got delayed hours due to a mechanical issuecould use a free drink or to make up for this inconvenience
negative, his cell phone record needs to be checked to see who did conversed with I trust the FAA can handle this better
negative, for wireless Was epic  you are the worst
negative, have you inspected the picture routine aircraft check while on his cell phone What will the FAA NYT say
negative, your Airserv contractors aren't worth a wet damn Late still not done w bags on They made checkin a calamity
negative, Will never fly with you again Terrible service Ruined our entire vacation
negative, web app won't let me upgrade call center wait time is minutes just want to get more legroom but it's a pita
negative, characters does not cover my reasons I'm afraid
negative, while busy on his cell phone
negative, fill out a form about my flight experience I sent an email to the email address
negative, Left gate minutes early My That doesn't count if you sit on the Tarmac for a half hour
positive, will the kudos to capt Herman be relayed to his chief pilot or should I be emailing someone
negative, on flight but it's not departing Website says delayed due to operational does that mean
negative, do you teach your gate agents lie Or do they just learn on their own There was overhead space for my didn't have to check
neutral, First Officer of UA checking our prior to departure from EWR yesterday while on his cell Safety
negative, i booked lh via ua However at gate they rebooked me to a Late Flightr lh flight Now that flight didnt earn pqd for me How do i get it
negative, coupled with cutting exacerbates the noted issues
negative, I appreciate the immediate but suspect it is more simple fix policy is awkward at best
negative, It isnt simple generally how you set up check policies at Logan and general unhelpfulness of employees in early AM
negative, terrible illogical after Cancelled Flightled connection Then made me pay to check bag Then lost bag
negative, I already follow you One of you agents rebooked me Went from a to an Ugh
positive, good job at CLE  TPA on schedule  to inches of snow
negative, never fails to have delayed flights
negative, myself and about other people also
positive, is Friendly
negative, it's been booked into first class with curbside delivery hours from now I'm counting on it
neutral, lets do that can you email boarding pass
neutral, We hope you don't miss your connection For help with Booking Problems please Follow us DM your confirmation thx
negative, is ridiculous delayed for hours and counting Should have booked with a diff airline that takes it seriously
positive, provide a voucher for one of my customers and I will tweet about you all day long
negative, at MSP employees trying to check in several hundred and the line is crazy might miss our plane be sure to thank these employees
positive, stellar customer service You have earned my business by your attention to detail
positive, service by staff was great as usual Cleanliness and smells a bit much I'll be back traveler
neutral, now arrives LAX am
negative, I do I was on UA LAX TO DEN we are scheduled to land LAX am please rebook to Denver best flight
negative, No first class passenger should have to pay for inflight wifi
positive, Hey you've upgraded me on a hour International flight I forgive you thank you
negative, my flight out of BGM Cancelled Flightled last I get a hotel but had to pay for a cab back Worse cab experience ever
negative, first flight to from is delayedbecause no one hooked up ground power to the plane Get it folks
negative, UA there is no way a plane loses its software I believe you decided to do an upgrade
negative, already missed connection UA
negative, typically once you get the problem fixed then the crew expires and the delay turns into a Cancelled Flight
negative, UA delayed again I get charged if Late Flight by you you say oh well
neutral, we are trying to go as far away from King'sCollegeLondon as possible for today Would you help us
negative, Friend stuck in bus on runway at PEK with two small kids no customer no kids awful service
positive, yes to more food Add some gluten free options while you're at it
negative, no U guys suck I'll never fly with u again And ur supervisors suck too
negative, on a flight to New York Love the quality planes on United
neutral, page United values your tweet it's so rare that they receive tweets complimenting their servicemost are fake
negative, yes there is when you keep getting the same robotic answer
positive, thank you for a great flight in gfc Cheers
negative, bad customer service to NYC a few weeks ago Thinking of moving on
negative, United's CEO has decided to outsource and or push out more and more of their skilled and loyal employeeslack of staff
negative, I your employees were really nice as I literally sobbed
negative, she means to say there has been so many complaints today this that she can't respond she's alone
negative, I was flying home for a event tomorrow You pushed back my flight Now I have a ticket that won't get me home in time
positive, They held the plane Made it
negative, you delayed our departure by hrs to wait for passengers from another flight that was Late Flight Unacceptable
positive, have sent u info via DM I appreciate your help and consideration
negative, flight from Chicago to Houston over hours and no pretzels or peanuts Seriously about passed out
positive, nice and early back home
positive, I hope so too
negative, after having to now TAG MY OWN bags at the airport I was hoping they would actually arrive WITH me here's hoping they arrive
positive, I'll make sure he's done that Thanks for the help This is a huge race for him and just trying to make sure it goes smoothly Peace
negative, I had planned to book additional flights tonight but after hrs working on one trip I'm worn out
negative, so much for being here to help Very disappointed in your customer service
neutral, If you'd love to see more girls be inspired about becoming RT our free WOAW event March at ABQ
negative, your system is down and after being on hold for over mins tells me she is going to charge a Flight Booking Problems fee Customer service
