neutral, What said
negative, Thank you for the reply Would've appreciated communication before checking in about the delay JetBlue used to be my
neutral, What confirmation number
negative, You also promised to change my wife's name on the account and it is also not done WTF
negative, You guys really suck I just spent minutes on the phone linking my credits to my account They are still NOT there
positive, Robin Hayes is speaking at next month's aviation summit He ought to give a shout out to his Twitter team You rock
neutral, follow for DM please
positive, oh And thank you for responding
negative, where is it coming from I thought Tampa
negative, Good perspective If only this safety concern had been expressed at some point before I arrived at the airport
negative, exactly why is my flight delayed BDL to DCA Can't seem to get an answer
positive, thanks We are ticketed on stand by for flight I hope we make it out Fingers crossed
negative, flight from BOS RSW all i need is my wife old to sit but no option when checking in
neutral, is your partnership with Hawaiian live Earn Hawaiian miles flying Jetblue  IF how do I add to my JB Flight Booking Problems
negative, You left PEOPLE on a hot plane with no ventilation for over an hour and a half and then had to bus them to JFK because of
negative, at what point in delays can I take a different flight to my destination
positive, thank you guys You are the best
negative, You just don't get it It's not about the It's about PEOPLE How about a public apology from the president of Jet Blue
negative, when you book a flight does jetblue separate a old from the mother Isn't that a bit stupid headaches
negative, does not fit in
positive, love it as always
negative, You never got my wife to her destination and you expect a goodwill credit will make everything You blew it
negative, every time I look at the flight more minutes is added to the delay How about some points for trouble
neutral, As soon as I sending my son home with you Saturday
negative, hey awesome what's up with flight from Boston Delayed
neutral, is there wifi on he plain
positive, what a great experience on flight from SFO to everything is top quality I will be back Very soon
negative, Flights and I have picked up twice this week for and both times it was delayed
negative, What's up with delays to and from Boston today My sister is trying to go and trying to come to RDU Craziness
neutral, wondering if it's possible for my colleague and I to get on an earlier flight tomorrow Can you help
negative, to Boston still sitting
negative, now we dont have enough money for parking in your garage this is your fault and im not paying for what should be into
neutral, hope so looks nice and warm in San Juan
positive, thanks for feel a little better we'll see how it goes
neutral, I usually I didn't make the Flight Booking Problems this teach me Yea I have that going for me at least haha
negative, I waited hrs for my bags and my flight was only hrs
negative, should I bother contacting them I already checked into my flight
neutral, early last month via an extra middle name and initial attached to my last name
negative, backlog is an hour at this is over two Unacceptable
negative, your agent told us TSA didn't have a crew to get bags
positive, you guys rock
positive, my email is my twitter handle followed by gmail
positive, Awesome
negative, no baggage crew update Your staff is incompetent with no answers after hours
neutral, the whole plane Flight from LGA to PBI
negative, is blaming for flight luggage debacle
negative, Yoga it is TV service seems to be down though I look forward to that do much
neutral, Dear your MBAs need better benefits They should work for us How can we meet them
neutral, of course I
negative, You failed That's the answer Please don't justify otherwise
negative, come on Already delayed hrs on flight as we waited for the pilot to come from now you reassign him Endless trip
negative, When I got your I immediately started looking to rebook But we only had minutes from reFlight Booking Problems to catch a flight to SRQ
positive, I only fly Jet Blue
neutral, Perhaps you need to start recruiting
positive, Start including PTO in your getaway packages and I'm all in
positive, thanks I will use the extra time to do some more shopping Did somebody say duty free
positive, flight Flight Booking Problems experience is pretty great
negative, still waiting to board and see if they will give us the exit row
positive, thanks for making my trip home next flight I'll take more selfies
negative, I shouldn't have to find they should tell us I've flown Jet Blue since your first month The experience isn't what it was
negative, if my flight was delayed can I show up at the airport with the appropriate amount of time for the delay or do I have to go on time
negative, I'm over that honestly just would like to get going on the journey
negative, If that was the why did your alert arrive so Late Flight delay Don't buy it
negative, our flight out no Tv Now our flight back not seated together Maybe our fault still no fun
negative, I don't believe so That's not what the team has told us
negative, also not have food available even for purchase is quite shocking since this is a hour international flight
negative, out of JFK no one has info no answers as to why we boarded the plane the team is in an awkward spot everyone is cranky
neutral, I have a reservation for tomorrow morning but trying to get back night bc other flight was going to jfk Can I get on list at CTG
negative, Flight is still waiting for bags Most of us checked in hours ago People are missing connections Please help
neutral, any way to get ppl on standby list for flight FLL to BOS Trying to find way home
negative, Something to think about when you are dealing with PEOPLE Just wrong No excuses Figure it out expect the unexpected
negative, I understand but wish you would have announced the delay hours earlier vs sitting for hrs at MCO
negative, what gives Delayed over hours at MCO to JFK Every time
positive, Well Brittany We love the clouds Enjoy the Thank you
negative, My wife was with our dog They wouldn't even let her out off the plane My daughter was at Newburgh lives close by So wrong
negative, According to your ground it hasn't even been taken off the plane yet
negative, thanks for making an effort Credit where credit is flight delayed hours instead of hours
negative, At what time All these passengers were sitting on a hot plane with no air and no communication for over hours Just wrong
negative, flight delayed at JFK then then hours Now it's back to hours with no explanation or apology
positive, thanks Have a good Sunday
negative, Flight had a hour weather but what is the minute delay in getting bags to tired passengers
negative, on Tarmac yest Cancelled Flight hr delay Why not send JFK closed saved all trip sit again
negative, flying out of BUF missing captain Really Delayed til Not happy
negative, it would be nice if the app would actually inform you that a flight is delayed
neutral, His name is Enzo RT Well hello there pooch What's your name
negative, I but I wanted to pass it along Not good for the experience esp for someone who flies times a month
neutral, Flight departed Phoenix at am
negative, So what about the plane stuck in Newburgh won't start It that weather reLate Flightd as well These passengers on plane for hrs
negative, thanks Home to MSY TSA precheck agents directing people after photo until scan beyond rude One grabbed and pushed children
neutral, Promo Watch Phone at Amazon check
negative, your hold music sucks
neutral, Customer of the year
negative, JFK north check in bag drop has been checking in someone for the entire another doing check ins too
negative, no excuse though for gate changes though
negative, if someone had bothered to inform us that the airport that would have helped
negative, get me home Flight from buf to Bos is missing a captain Really
negative, nope This flight is now not leaving until almost I can't believe I paid money for this
positive, thank you We are finally at the gate
positive, flight to Orlando is unable to serve hot bevies So they've made movies and alcohol complimentary That works
negative, the only update we get is that they have no idea when we will get an update Way to go
negative, will you cover the cost of my car service waiting time
neutral, don't I always
positive, Landing As usual great flight wiyh a great crew Hello sunny West Palm Beach
negative, this is ridiculous we are on hours coming up of waiting to there are are newborns on board
negative, waiting at HPN on plane more than an hour since landing of no please get us off this plane
negative, too Late Flight Several passengers are inebriated You're in league with big alcohol Shame on you
negative, thanks for making my vacation not worth it again Currently waiting on the runway for another hour to DEPLANE
negative, letting me down in San Fran No Media rate What's the deal Looks like this is the last time I fly anywhere with you
positive, they were amazing and thank you
negative, and have empty help desks
negative, there was a closure People here need to inform not send them gate to gate w no info on boards updated departures
negative, according to jfk plenty of planes are landing No problem there
neutral, when will the system be up and running
negative, Thanks for the THIRD gate change
positive, Beautiful shot Thanks for sharing Using to post Your welcome Not on this flight It was a
negative, Flight JFK to Cartagena all at this airport bar singing the opposite of your praises We're making a pact to never fly u again
neutral, to Austin
positive, she helped me with my problem so easily and was so you guys rock
negative, what happened to our plane meant to leave Why do we have to wait for from buffalo Seems organizational error not weather
negative, where is the award winning service
negative, really not acceptable Just informed plane won't start Chartering bus to take passengers to jfk
negative, how much longer to JFK open's I am a diabetic and I need sugar plane don't have nothing
negative, flight now sent back to the gate even though the app says its leaving Anyone have a clue It's and sunny at JFK
negative, u guys have kidding No help anywhere hour delays Still no answers Bad cust service
negative, they are now being sent off the plane Does anyone at JetBlue have a clue
negative, unfortunately I was so startled and I didn't get the but will provide a description in my expanded email Thank you
positive, your customer service agent Bonnie is amazing on the phone she deserves a promotion
negative, just a very rude rep while trying to book family vacation using trvl credit on phone new rep now who is being very helpful
positive, BOS Everything current now Thanks for the follow up
negative, it's sunny and gorgeous in ny actually What's the real reason
positive, thanks for the info Already doing it now before we board Looking forward to the future upgrades
positive, things happen it's ok just wish I was on the beach and not in the airport
negative, it's been why have you not sent the plane from the hangar for flight at JFK This is absolutely ridiculous
neutral, any idea when the flight will actually take off
positive, I love  when will we be able to charge our devices on domestic flights Thanks
negative, still sitting in plane in Newburg This is getting No way to treat customers
positive, Touchdown JFK Well done pilots of JetBlue Flight
negative, what's the delay if the system isn't down
neutral, Not blaming Jet Blue This wasn't weather Can't have planes in the air and runways a mess That's a disaster waiting to happen
negative, don't think rly knows what's goin on supposed leave at then then then then then Now
negative, That is not very gracious of to tell me where I can go BUY water or a snack when our flight is delayed over hours
neutral, and ask she load the bag for my flight
negative, after applying my new she left my bag on the ground rather than loading on the conveyer beltI had to walk back yards
negative, get flight into the air
negative, That's not weather reLate Flightd You are just being nice and blaming the weather Airport just wasn't prepared Investigation time
positive, if I had my it'd be a date
positive, Thanks for the personalized customer service
negative, then this agent demanded I remove my old luggage every other airport the JB agent politely handles it
negative, I'm also a mosaic customer and fly jet blue ALOT
negative, It's not so much the delays as the fact that the flight is still coming up as on time on your app Just give us an honest estimate
negative, she waved someone behind me to step forward although I explained what happened and indicated my need to make my flight
negative, Flight is departing before we even board
positive, I knew there was a reason u were my favorite airline Just read you answer on twitter in globe this morning Great job
negative, here's was at bag drop inserted my JetBlue didn't print pass Agent standing in front of me refused to print my pass
positive, it's only because I'm wearing
neutral, 
negative, That's not what I heard Weather was fine this morning Flight was circling for some timeSomeone forgot to clean the runway
negative, When it's mins past scheduled time no departure in sight a flight no longer qualifies as on time
neutral, whatever your lil heart desires
negative, how can your entire system go down No IT Really
negative, Appreciate the heads up at that my flight was delayed bc the crew is stuck in Boston
negative, seriously System down No IT
positive, yup we not your just not ideal sittin for over an hour but as always your staff is great
negative, just had a horrible experience with check in agent at fort I'll document and send off to Boston
negative, to Carta what is goin on told plane coming from then gate now no one knows wat plane we're getting on
neutral, have a cpap machine for sleep apnea Is this OK to carry on if I also have a small bag for clothes
positive, got it thanks the quick reply
negative, isn't this something YOU should do Why should I tell your crew how to do their job
negative, your app needs updating Says my flight is on time when we are well past boarding time with delay
neutral, do bags still fly free or have you started charging thanks
positive, had a great experience working with Glenn Coles at Airport Top notch employee
positive, the last update was in the right at least I'll keep my fingers crossed
neutral, Charleston from your app guys as of a few minutes ago
positive, social media person
negative, Are there delays at BOS or did we just get unlucky with
neutral, Just left in a little over hours
neutral, I hear you and safety is I think we can get to JFK though now so let's help the passengers crew get there safely
negative, is JFK still closed Tryna get out of Ft Lauderdale on flight just want to get home to nyc
negative, woulda been nice of you to let us know that or post it Your boards still show the flight on time
negative, hmmm it says im following you We just got but still haning around for the runway to clear
positive, always how can you not love
negative, flt from PHX Delayed circle divert to upstate just sitting for hr No communication
positive, they miraculously fixed the plane to shoe ever it was
neutral, that's cause we're TrueBlue It's ur that keeps liftin' me
negative, all your online resources say we're on but clearly we are not This is not very information age of you
negative, No crew at our gate
positive, yall are really better then American Airlines though
negative, why don't YOU tell them to update the boards
positive, What can I say other than when it comes to my ur my
negative, Issue is JFK Pilot explained once JFK reopens we can get scheduled back but why can't we divert to LGA Closer than ACY
negative, you want me to talk to the wall
positive, Great service from PBI to HPN Thanks
negative, Its poor Flight management There is no reason why a scheduled pm flight to takr off At
neutral, hi is there a way we can check to track the flight that will arrive that will be our flight to depart
positive, thank you
negative, note the time this was taken at and flight still listed as on time for when I'm not onboard
neutral, will do
negative, why is my flight listed on time when its and I'm not on the plane yet
neutral, ok should I start looking into other flights
negative, ok we got as far as Atlantic City due to JFK being closed Can you get us to HPN or LGA Please
neutral, on flight from Nassau to JFK Not showing Cancelled Flightled yet but assuming it will be Any info
negative, we need an ETA please
neutral, you can confirm that
negative, fly delayed do to ice at JFK  Can I switch to a Late Flightr flight for free
negative, I'm at will be nasty in Boston Have family driving min to pick me up from Erie think flight what if Cancelled Flighted
negative, best way to kill nine hours at the airport when all flights are full and the airline won't put you standby
negative, they said the runway isn't ready and they're waiting for port authority to remove the snow and they are no where in sight
negative, I travel for business twice a week and after the I'll be flying blue more often Thanks
neutral, we are on flight and were returning to the gate can you provide any information
negative, won't see my money again after their poor service should have stuck with virgin america what was i thinking trying jetblue
negative, suck and their customer services are the worst whats the point of having a loyalty scheme that they don't honor
neutral, I see my flight from Boston to Pitts is ok from this afternoon Did you have any delays for the morning flight
positive, FLL to great great customer THANKS mths waiting to speak to a human at customer service
negative, how about an update on flight leaving tf green delayed
negative, well they said Cancelled Flight on the PA system Guess they are trying to get a plane from Boston And not a confirmed
negative, that's where we all get on the same page Cancelled Flighted it mins ago help flights from to MCO
neutral, I'm so sorry I cheated on you with Please take me back I wore protection
negative, my flight Cancelled Flighted due to lavatory problems Can't confirm if they are gonna get a flight from Boston Logan Int
positive, okay thank you I'll check with them again
negative, some woman stole my seat on the plane but I was the one that had to sit elsewhere Is that standard protocol
positive, Good Sylvie Have a great flight Thank you
positive, They just came out Thanks for the That's why you're the best
positive, Thanks See you soon
negative, still waiting for bags at What's the holdup Looks like we are the only flight that got in at this time
positive, thanks for getting us to NYC really safely But srsly How long does it take to get our checked bags
neutral, should I expect delays at dca for departure Going to Orlando on flight
negative, full the six of us had to leave flight And now have to wait a whole day to get a flight and my kids will miss school
negative, no Not boarding order Someone boarded with Service Animal which a member of my party was allergic to and because the flight was
negative, it's ridiculous that I just got home and I was supposed to land hours ago bc I am HELLA tired
negative, just lost very loyal customers who use them times a year
positive, thanks for the response when is the next flight after the flight
negative, Highlight of my travel is hour delay and twice Now sitting in bumper to bumper traffic in taxi to finally get home
positive, great flight on a brand new jet Great seating Beautiful plane Big fan of this airline
negative, a voucher I can't believe I took this risk Not only was the plane terribly filthy and I had screaming babies in my face
neutral, download jeokoo the American app for air travelers
positive, thank you I know the weather in isn't great Everyone's tired
negative, I've spoken JB team and explained situation Didnt seem to matter to anyone other than me I guess I just expected more
neutral, Alright I hope My JetBlue app is showing a change in my seats and online shows an Don't want any surprises
neutral, I know you guys are super busy but is flight an or
neutral, Follow me pls
negative, Shocked by misbehavior and cheap comments from jet airways staff to passenger at Delhi Airport Friday boarding to Dubai Disgusting
negative, you have to service your remote controllers on my flight I watched equalizer THREE times because my remote was stuck
negative, oh wow and I'm complaining about two hour on the run way shucks JetBlue NOT GOOD your service was better than this
negative, I'm curious to know how do you compensate for passengers missing engagements due to a two hour wait on the to get to a gate
positive, thank you thank you I finally set up the jetblue app Yay
negative, everytime I come back to Boston it's a minimum min wait for bags Earlier it was almost an hour Why is it only Boston jetblue
positive, Thanks for taking me back home today despite Pandora's best efforts to Cancelled Flight the flight
negative, that is not what your employee at Logan told me I finally got one to meet my daughter on her first solo flight after rude rep
negative, I am But Your customer service is Brutal
neutral, Airways to continue 'various commercial relationships' with
positive, Your airline sounds outstanding and your Twitter feed is clearly extremely useful Keep up the great work
positive, is amazing Had a short delay They gave me credit It was literally pretty much my fault I missed the flight
negative, flight attendant was hesitant to give me more baby sized cookies
negative, Y U NO LET ME OUT AND MAKE FUN SIZE COOKIES
positive, thank you standing in line now
negative, thanks Yes order me a rum and coke and get me a hotel voucher because the floor and chairs aren't so cushy here
neutral, is that supposed to change in the near future
positive, thank you
neutral, Can You please help to save my daughters life for details Go here
negative, You can pass that along to my daughter's my elderly They spent several hours waiting
neutral, I will when I land
negative, I missed a goal On because of your Inept male stewardess I should have landed already but I havent taken off yet
negative, you are doing a horrible job at JFKyou need to rethink how you put these routes together Unprofessional
neutral, do bags still fly for free anymore
negative, can you let me know status of flight delayed now on board problem with hatch
negative, thanks for response Crew has been VERY patient with but they are also frustrated Wouldn't be so bad but airport is closed
neutral, 
negative, Why did you interupt the Staduim Series on I dont need to see your stupid commercials or Emergency Info
neutral, when will you release flights for February
negative, we are well aware Insufficient info No options
negative, just sat on a plane for hours in Dulles
negative, can we get a honest update on departure of flite Been on plane with infant children
negative, u suckwe have been sitting here for because of ur negligence
negative, still waiting for bags from flight It landed an hour ago
negative, Complete waste of an entire day Pathetic
negative, flight you had us stuck on the plane for nearly hrs Set to take off only for flight control to deny us THE WORST SERVICE
neutral, I would love to Fort Lauderdale now that would cool
positive, the best
positive, thanks for bringing my son home to me
positive, you got yourselves hot ladies flying the air for life
positive, nothing but praise for you helping our lady make her flight to CHS tonight
negative, she did she's still waiting on a callbackthe lack of follow through is what's concerning smh
negative, she hasshe hasn't heard from anyone in over a week a nonstop flight and her baggage was customer service
negative, we got our luggage after waiting mins and went home right after Not very family and ADA friendly waiting that long w no chairs
neutral, I flew on a flight about months ago Me and my girlfriend got away with having sex in a restroom Is it allowed now
positive, thanks so much Can't wait to fly with you guys
negative, Flight out of hr delay I could get over it if it was just weather reLate but considering it's not Come on
positive, thank you
positive, thanks for a speedy flight time recovery
positive, thank you for taking care of me with a drink since my entertainment wasn't working
neutral, Flight what time does bus leave hotel on Feb Mass confusion here
neutral, Are we able to change to an Even More Space seat after we've checked in online Have a flight tmrw and can't seem to change my seat
positive, would you say a delay is more likely Thanks so much
positive, I did not She's a woman who's a she was working at gate
neutral, what are the chances of one of your flights leaving at out of Newark nj being Cancelled Flightled tomorrow
positive, If you follow I will be able to DM you Thanks
neutral, Tomorrow have been soon enough Thank you for the info
negative, figured it out flight Hard to believe with oil so and the killing u make that even part of a hotel can't be comp'd
positive, I want to give a warm thanks to your crew at Logan airport for still getting me to the DC area after Cancelled Flightlations this morning
positive, Another awesome telephone experience with Thank Cory
negative, we saw he was as useless as the tsa agents who inspected my shoes
neutral, Have a cup coffee and relax while you check out the New Deals and Promotions at twice a month at Doug
negative, disappointed with the missed connection from ROC to SLC and no reimbursement even tho friend who is a pilot said it was due to ATC
neutral, yes Party is Over
positive, thank you
positive, he just went above and beyond to be helpful
negative, didn't find them unfortunately but he was very helpful and took down my info incase they do get found
neutral, that selfie was extreme
