neutral, What said
negative, hasn't evennotified us that theflight isdelayed via callIf we wererunning Late Flight I would be pissed
negative, can tweet through the bad but closes down customer relations center to process refunds for Cancelled Flighted flights
negative, stop Cancelled Flighting my flight I have US history tests to take and chemistry things to learn do you not understand
positive, SAN flt attendant Melissa was awesome great After weather Cancelled Flight day it was welcome
negative, been all up and down the area where the pic was taken and don't see any albums
neutral, I enjoyed a call from my good friend he's Flight Booking Problems his flights elsewhere as I tweet one at a time I will tell as many as I can
positive, thank you Great customer service so far Accidents happen I understand Hopefully everything works out
negative, my question is what's up with the crazy boarding procedure Does the confusion prevent fistfights over the good seats
neutral, opened online applications for Fall intern positions throughout the company Apply via
neutral, honesty should always be the policy
positive, thanks for the quick response Should I call daily it wait the days
neutral, I knew I was correct
neutral, briughy me to so much more with the
neutral, any deals to orlando in
neutral, Desk Plants Increase Productivity by
neutral, New marketing song let us know what you think
negative, prove Cuz the southwest people here don't even know why it's behind schedule
positive, seeing your workers time in and time out going above and beyond is why I love flying with you guys Thank you
negative, u were bae until u lost both of my bags and had no clue where they were or what happened to them for hours
negative, prove it
positive, Travel agent Darrel here at Love Field hosting a paper airplane contest to entertain all the children was so awesome to see
positive, Big kudos to your staff today at Dallas Love Field for lifting everyone's spirits today with all the delays and Cancelled Flightlations
positive, it's not fun having a delay from Nashville to Las but the crew at the gate desk has been AWESOME
negative, thinks that a voucher makes up for spending hrs on a plane and landing at the same airport we took off from Really
positive, Never got to the strip that fast before Stoked for special show tonight Thx again
negative, The problem is apologies don't help Results matter and it's proving impossible to find anyone who is interested in that
neutral, no fare giving out clues In route now
positive, telling my Fam in Vegas now
neutral, How many tickets are left
positive, thank you
negative, is new strategy to be average like all the rest RR Points AGAIN
negative, do these scavenger hunt locations have anything in common because I'm playing detective trying to figure out the one for ATL
neutral, Why do you have to be
negative, ruined my Sunday hours of delays out of now my bags are at the wrong airport to deliver them Insult to injury
positive, What can we do to bring you back to MS We miss you terribly around here These other airlines are horrible
neutral, Any idea why TSA isn't showing for my next flight tomorrow The number is in my profile
positive, hours and degree difference Yes please MHT TO MCO
negative, sent looking for that functionality in your though should be a one click action
neutral, still there I was posted up in Downtown waiting for y'all On my way
negative, like kelsey really bad spot for locals Do you know how long it takes to find parking then walking over to the bellagio
neutral, are people there
positive, looks like Bellagio to me Good luck people See you at the show at Vinyl
neutral, Congrats to these fans who are seeing in LA you're next Thanks again SW
positive, Can a pair of tickets waiting for me after my sports practice I live here and definitely know where that is
positive, Love Southwest You guys have been good to me
negative, how about tix for tonite for the inconvenience since I am not there to play scavenger hunt
neutral, if only practice was an hour Late Flightr today
neutral, that was supposed to say boo not book booo
neutral, I was there days ago Miss the Warm Weather
positive, Your crew on is doing a great job of keeping everyone informed during the delays
negative, right We're delayed so I'm crabby Also why do you allow one family member to purchase EarlyBird check in and hold rows
positive, really easy for locals to get down to the strip book
neutral, grrrrrr I need a flight there first Maybe for my bday next month
positive, LUV your new Luv Television Commercials Traveled on your airline last year return trip from
neutral, is it possible to add travel arranged by my employer to my upcoming travel I can retrieve a but that's it
neutral, I sent a email to customer relations and I will be calling tomorrow
neutral, how do get priority seating after you already paid for the flight
negative, people pre boarded Only needed a wheel chair off the plane Was NOT the case boarding
neutral, Is it possible to add companion to only the leg of a trip
positive, best airline
positive, Nice to see you prioritize Internet traffic to your own streaming service over other web sites
negative, Poor customer service displayed over the weekend during the storm I was stuck on the tarmac for hours with no answer
neutral, Northern California coast
neutral, hi do you have a general enquires email address please Thanks David
neutral, watching planes do their thing
positive, Thanks for getting us to paradise safely
negative, Feeling very frustrated that I bought WIFI onboard and can't load an email
neutral, continues to prove to be the best airlines
positive, Just go ahead and start the scavenger hunt after pm today when work is over
negative, why do you let one person board with early bird and save seats for entire party
neutral, thanks
positive, Awesome staff at the check in desk They had a paper airplane race for a SW gift card to keep ppl entertained during delays
negative, but when do I get my gin tonic
negative, is this a sick joke
negative, please explain to me why every other flight to Dallas is going out today except the pm
negative, will continue to be my airline of choice frustrating travel day I've experienced delays and gate changes
positive, just got a call apologizing personally for the long waits last week trying to rebook flights Class act I appreciate that
negative, Serious potential for a wanna get away commercial out of this debacle But for you should fire
negative, I appreciate the but the constant changing of the flight time is frustrating to say the least
negative, how long do we have to be delayed after boarding before we get a free drink
neutral, done I thought I was already
negative, I can Doesn't it seem fair that if our bags need to fit under our we should need to fit in them
positive, Your Terry is our hero Got my husband back thru security to retrieve cellphone left on plane in Austin Terry U Rock
negative, Just wanted change an anytime flight leaving at Phone hold Phone she says sorry no dice
negative, weren't too sincere when you Cancelled Flighted my flight and made me drive hours to get home
positive, Your Terry is our hero Got my husband back thru security to retrieve cellphone left on plane in Austin Terry U Rock
positive, Your Terry is our hero Got my husband back thru security to retrieve his cellphone in Austin Terry You Rock
positive, you guys are the best
positive, I'll stick with flying for free any where that Southwest my son works for this wonderful company and Moms fly free
neutral, if only you could control the weather in Las Vegas
negative, pretty terrible customer service Sat on hold min Then a busy signal Then disconnected Do all airlines have to suck
neutral, could you please tell me if there is a way to add a to a flight that already took place
negative, hooking us up and getting us to Tampa after our flight was Cancelled Flightled this morning
positive, love the passbook update Used it the day after it was released Finally Thank you
neutral, my ticket was booked to CUN Does the arrival time reflect that CUN is now on EST time
negative, yes I did I hope for an update need those clothes for a meeting tomorrow
positive, to the Safety Dos and Don'ts Announcer Flight from Midway to Pittsburgh
negative, this is not a fair set up I payed for a full seat I should get access to a full seat
negative, Sorry to bother but I've been on hold for more than hours and minutes Should I continue holding Or call back
positive, another great trip LAX LAS BNA Thanks so much
negative, your checkin is lame for business Really last seat I have broad shoulders haha
negative, yeah they're somewhere Hopefully getting them back today Just frustrated tweeting
negative, Completely understand Act of God Flightd Cancelled but days without reimbursement of any kind is
negative, why so expensive to go to Vegas with stops in Late Flight June as I can get non stop for same on competition
negative, delayed twice now Cancelled Flightedsent complaint yet no response Need an explanation pls
positive, Got help from a nice lady on the phone in Georgia Thank you
negative, When will the flight resume I don's see it in the open schedule
neutral, understand the these kids need to get home Nice kids doing volunteer work from a RI high please help
positive, Thanks for the quick reply I travel a lotbut not that lol
negative, That does sound hopeful It's a very thin device so I just hope the right person found it in time
negative, My bag was not shown LUV did not make it to PHL with me
negative, I regret not flying you this morning doesn't support business travelers
positive, Thanks I did go through these motions shortly after my flight yesterday I wonder how quickly flight attendants are notified
negative, how many others didn't know you are stopping non stop flights to ATL and from to Hartford Ct as of April
neutral, Lindsey Any idea when I'll get there Stuck in Denver and told to listen to the intercom better
positive, nice touch on the passbook integration
neutral, easy let the business select actually board then board the
negative, a companion pass flyer to other airlines because it's being abused every airport
negative, it's not it's a blatant disregard for your business select it's becoming a problem that's pushing
neutral, need assistance getting an extension on a flight that has expired
positive, Awesome Thanks You guys rock
negative, Hello remaining credits on your account will be refunded back to your credit when you choose a lower price flight
neutral, when can we expect customer service in Dallas to be available
negative, it eventually arrived just seemed really slow
negative, My bags are on the way to without me Help I was confirmed for flights and told there isn't room and I'm screwed
negative, i just recieved an email from your memphis station hopefully they have my bag
negative, Just landed in PHL Row window cover on could use some LUV
positive, thanks for adding passbook ability Hopefully we can do group passbook tickets in the future somehow
negative, yep certain it was on that flight
positive, they arrived Late Flight but pilots got us to DIA on time
positive, I would appreciate that Thank you
negative, I never got an email confirmation for my but the credit card was charged Phone wait time is crazy Is there a chat
negative, res chg no still on faster for hubby to DRIVE to airport to make change counter
neutral, Can my wife's RR points be transferred to my RR account
negative, my friends from Boston stuck in Denver Her name Jane Please contact her
negative, I but no one can find the bag and we need everything in it in the next two hours
negative, Wasn't able to sit in my seat since the guy next to me was using it
positive, Glad to know I'll be flying the luv airline tomorrow
negative, yes we did file a report and were treated rather rudely at midway baggage claim Now we wait days to get our luggage
negative, I would still have my companion pass if your ridiculous airline hadn't stopped partnering with Hilton Hotels GENIUS
negative, Just got companion pass and trying to add companion flgt but get Help
negative, I did Still haven't heard a thing
positive, thank you for great customer service Trying to make it to San Antonio and your staff and alerts have been helpful Boo ice
positive, open seating is like an open there's so much love for strangers
negative, I hope this isn't a real life scene out of the movie 'Flight'
neutral, thanksare flights operating now or Cancelled Flightled
neutral, we checked in right at mark Boarding C group with kids ages dnt want to be split What sld we do
negative, her name is Jane and she wanted was a call
positive, And this is why I love flying Southwest Excellent and you don't take yourselves too seriously
positive, what's even better is the price changed in the minutes since I talked to the lady and they still honored the
neutral, Helloare flights taking off from airport this noon Am supposed to travel on flight to San antonio
neutral, We invite to Fallow learn about our activitiesPrevention Programs of Health by FamilyWe R
neutral, unveils new including from
neutral, to start daily flights from Reagan to on
neutral, to end its daily flights from Reagan to on
neutral, to start flights from to OR on
neutral, to start daily flights from OH to on
neutral, to start flights from OH to on
negative, Password reset email is incredibly slow to arrive today Checked spam too Web site says a few but
neutral, Thank I may have already responded but was
negative, I've had TERRIBLE service in three airports in hours Glad they don't care we kind of need to be home
positive, Thanks Confirmation number just DMed Appreciate any help
negative, on hold for minno estimated answer time Any help here
negative, I'm going to start charging you for the consistent body pat downs Starting to feel like a piece of meat
negative, What's up with the wait times on your customer service line Tried on Fri and now I've been on for over min
neutral, Can you equip a with flamethrowers and a snow plow
neutral, unveils new including from via
negative, flight no delayed hours Another week another delayed flight
neutral, thanks for linking to Might be old news but this is my first flight
neutral, didn't realize no clothes until at hotel suggestions
neutral, may want to direct that to the people at tok
negative, bag in possession but no clothes in bag
negative, you're really going to let and get the best of you
negative, Please get back with my about my airtran credit I call and I'm being told that I but I never get back
neutral, is there a link to a site that displays any delays or Cancelled Flightations of flights to and from
negative, pleaseeee resume direct flights from FLL to PHL I don't want to fly with anyone else
negative, what to do when you show up to your destination with no clothes in your suitcase
neutral, Are there discounts every tuesday cause Im leaving fron Birmingham Airport to San fran Next week in march sometime
negative, does anyone realize that banning peanuts on a flight due to an allergic person ignores oil dust from previous flights
negative, customer service is rude and bothered by our calls Has no idea what is going on and sighed heavily on the phone Unbelievable
negative, hrs Late Flightr human ended up a completely new flight so last flight out didn't sell out
negative, loses baggage a day ago and still has no idea or interest in finding it ALL items for new job in that bag Unacceptable
neutral, How do I get a companion pass Lin S
positive, Just sent DM Thanks for your attentiveness to this matter
negative, how about fixing the wifi flight where it's not working series plane so not like it's an old plane
negative, Like most if I'm watching free TV it works but won't hardly access any websites including your own
neutral, kids on a mission trip from Lasalle stranded in orlando they can't get back to Bos or PVD till WEDNESDAY
neutral, Pls Help Baby Hannah get the life saving surgeries she requiresShe needs your helpPls
negative, almost at the gate for to SF Please wait more seconds
negative, RT Paid for early bird boarding and got I said to that system is about dead She didn't understand
negative, All flights are booked  They are saying I have to wait until tomorrow
neutral, arrangements to reimburse me for the rental I had to get
positive, Me on one of your planes Thanks for taking me Arizona
negative, Gate agent gave me wrong departure info and caused me to miss my flight and now I am on stand by
positive, Thanks
negative, my bag was and according to the rep they don't even know where it Please help
positive, have sent you a DM with the details Thanks
positive, thank you for the confirmation Maybe people on my flight have directional dislexia
neutral, got an email confirmation of wifi purchase on a recent flight Trouble I've never flown with you Ever
negative, really All other carriers are staffed and you've got a triple looped one and no employees in sight in OKC
neutral, Flight departs enroute to
negative, thank you for Cancelled Flighting my last minute of to I'm now missing one full day of my trip thanks to this
neutral, Are flights going into Dallas this morning Thanks
negative, you got me home over an hour and a half Late Flight but at least my baggage was delivered soaking wet
neutral, had to be stuck in the middle seat
neutral, Scavenger Hunt BE READY
positive, you know what'd be beyond awesome A pair of tickets to the show in ATL A girl can dream
positive, yes I was everything worked out great
positive, show me some love and a companion and thank you
negative, Cancelled Flightled my rescheduled to EWK gave me a that directed me to the worst in existence
positive, loved it
negative, needs to train their employees to be at lease somewhat empathetic when THEY lose our luggage Monika at MWA needs a PR lesson
neutral, I am let's do this
negative, You completely let me down tonight Your gate agents' ambivalence is just too much How sad for you
positive, you're my early frontrunner for best airline
neutral, kudos to your rep Patricia at gate this Sunday morning at
negative, flight Cancelled Flightled new flight hours Late Flightr will sleep in airport tonight and cant even give me an A Boarding Group seat thx
neutral, Just reading your boarding we're a group of travellers with kids ranging from is it possible to sit together
negative, you're I do I've been traveling all day and you guys dropped the ball Making for a long night
negative, customer service has been very passive in their response Disappointed I have only flown SW but am rethinking
negative, broke the stroller my wife and baby gate checked They told her it's not their problem Calling the A List Preferred line now
negative, is this a joke My return flight is delayed too in a row New record from you guys
negative, nbd I was able to figure out a workaround Just wanted to help Got my bags less than hours Late Flightr Muchas grassy ass
negative, luggage delivery between Really After I was told by midnight multiple times Why lie Crazy and bad business
positive, Thx for the follow up Just sent DM
negative, now I don't get the common courtesy of my phone call answered Either policy is bad or people should be fired
positive, TY for your consideration
negative, apologies are whatever Please just deliver the bags like you said you would Feel like employees are lying to me
negative, what robot is running this account The same one that doesn't remember anything they ask Same conversation over and over
negative, It was never really lost it was put on another flight WITH my knowledge we just weren't sure what flight but I have it TY
positive, crew of was brilliant Rita was hilarious I know I've been down on you but this was a great flight
negative, is not being responding to the athletes
negative, A whole with a special Olympic athlete and you can't even call them
negative, would really like my baggage from yesterday Employees at Akron giving me a tough time
positive, thanks Very excited to see it
negative, glad you appreciate be the last dollar you ever get from me thanks to your wretched customer service
negative, waited mins for baggage and the service was suspended so no drink
neutral, flight going to add min extra because of the roads snow
positive, Thanks for helping my mom after wouldn't let her get on her plane in Orlando You're the best
negative, me again I was just trying to rebook fare on wanna get away pricing and it disappeared in time I refreshed Is this normal
neutral, I know that not everybody on flight can be time flying But in case it is people in front deplane not from the back
neutral, may I have my Companion pass please
positive, kudos to the crew of flight to GRR for making a very special memory for a sweet young and her Momma Well done
negative, thank you Paid for early bird and sat in back
positive, All good beers and ar
neutral, please
negative, minute wait for my bags Just what I needed on a Sunday night
positive, luv my companion pass
neutral, Winter Weather for Denver extended for tomorrow by chance Even to Late Flightr in the day would be super helpful
negative, it's ok I was supposed to be in California ago
negative, I need to Cancelled Flight one leg of a but can't seem to do this online Been on hold on the phone for minutes Any help
negative, preferred flight Cancelled Flightled min prior to boarding Best option was Tue afternoon Seriously Epic fail
neutral, Free TV watching Daytona
negative, I understand But it's and been consistent for years It's known around the country
positive, thank you
negative, been dealing with multiple offices for the last days Youve completely lost me as a customer unless my bag is back to me
negative, i got the call from RDU that my baggage is there except that doesn't help me bc i can't get it until I'm flying back home
neutral, how do I get a companion pass
neutral, especially if it's your mom
neutral, how you like the treatment
negative, For can't pay hotel food Or transport to alternate city we are flying from Or give clear record of alt flight
neutral, I'm flying out of CUN tomorrow To DEN can I change my flight due to the travel advisory
negative, Tough I can take Zero meaningful assistance while stranded for days is another matter Looking for signs you care abt cust
negative, Don't apologize Do something about it Words mean nothing Actions work EOM
negative, after an hour and a half then it came back damaged Not happy
neutral, how long does it take for my Rapid Rewards points to be credited to my account
negative, why does the customer service have rather inconsistent information
positive, we're pulling off the runway now Making new friends with seat mates Thanks for the response CB
negative, but to make us tru to find space in other flights This customer service is as bad as
negative, no delay I pay for BS ticket You boarded flight early I'm last to board Now have middle seat Wasted
negative, first you had a good idea thatthis would happen and did not Cancelled Flight it then very amateurish that there was no plan
negative, very disappointed in your handling of tonight's Cancelled Flighted Dallas flight Not that it was Cancelled Flighted but no contingencies
positive, it's ok Southwest is still the best airline around Just hate when baggage room runs out My now checked bag has headphones
negative, please start flying to Huntsville so I never have to fly American Airlines again
neutral, Flight arrives at following flight from
negative, no you are you just care about mighty dollar
neutral, I have a child traveling cross countryshe's will be turning in marchand
neutral, how do you get one
neutral, retiring with my hubby and it's our wedding anniversary this year Companion pass please
positive, beautiful view flying into San CA this evening
positive, Thank you SWA and Shannon G for being a miracle worker
negative, But expect no help from Our flt was canx at the last minute for weather We flew home on weatherless
neutral, want go from New Orleans houston see my dad at md anderson can you help me out
positive, yes please
positive, I changed my flight through St Louis Thanks for the reply though
neutral, flying by myself is getting old
negative, really shouldn't offer sweeps if your link isn't going to work B
positive, Have had a companion pass for a few years and my wife and I use it all the time Thanks for making travel easy
negative, Why can we no longer change trips with a companion online Been doing it for now get message can't be done online
negative, WIFI is so slow it totally precludes working on the web Will NOT book SWA for business travel Wish I hadn't lit on fire
neutral, yes pleasemy son lives in NJ
neutral, companion pass please
positive, constantly providing wonderful views and service
negative, everyone deserves red carpet tx until they destroy your luggage give you like I want to fly again
negative, staff was overall awful through multiple airports would have switched airlines if another flight was available
positive, lol I already am  I am a card member as well too lol i enjoy flying with you Guys
positive, Anniversary on April Still Sweethearts Companions Lifetime Sons Families Love
neutral, we all need something to aim for
positive, YES pleaseHow do we get that companion pass
negative, on flight and I paid for wifi that can't load a website functionally except for your own live streaming Unacceptable
neutral, gimme
neutral, flights still going to DAL
negative, You've inspired me to start my own airline to combat your weak ass airline sick of this shit
neutral, is service to Aruba being permanently discontinued in August
positive, yes please
positive, I miss mine terribly A for my anniversary would be amazing It would mean LUV is in the air
positive, I my CP status Sure would be nice to have though
positive, Southwest Companion Pass would be great
neutral, I would love a great deal from bwi to las Memorial Day weekend aka my bday weekend
