neutral, What said
positive, plus you've added commercials to the experience tacky
neutral, I didn't today Must mean I need to take another trip
negative, it's really aggressive to blast obnoxious entertainment in your guests' faces they have little recourse
negative, and it's a really big bad thing about it
negative, seriously would pay a flight for seats that didn't have this playing it's really the only bad thing about flying VA
positive, nearly every time I fly VX this go away
neutral, Really missed a prime opportunity for Men Without Hats there
positive, I NOW I DO
positive, it was and arrived an hour early You're too good to me
neutral, did you know that suicide is the second leading cause of death among teens
positive, I pretty graphics so much better than minimal iconography
positive, This is such a great deal Already thinking about my trip to I haven't even gone on my trip yet
positive, I'm flying your skies again U take all the away from travel
positive, Thanks
negative, schedule is still MIA
positive, So excited for my first cross country flight LAX to MCO I've heard nothing but great things about Virgin America
negative, I flew from NYC to SFO last week and couldn't fully sit in my seat due to two large gentleman on either side of me HELP
positive, I flying
positive, you know what would be amazingly awesome PLEASE I want to fly with only you
negative, why are your first fares in May over three times more than other carriers when all seats are available to select
positive, I love this graphic
positive, I love the hipster innovation You are a feel good brand
neutral, will you be making non stop permanently anytime soon
negative, you guys messed up my seating I reserved seating with my friends and you guys gave my seat away  I want free internet
negative, status match program I applied and it's been three weeks Called and emailed with no response
negative, What happened ur vegan food options At least say on ur site so i know I won't be able eat anything for next hrs
neutral, do you miss me Don't worry we'll be together very soon
negative, amazing to me that we can't get any cold air from the vents
neutral, LAX to EWR Middle seat on a red eye Such a noob maneuver
negative, hi I just bked a cool birthday trip with but i can't add my elevate no cause i entered my middle name during Flight Booking Problems
neutral, Are the hours of operation for the Club at SFO that are posted online current
negative, left expensive headphones on flight IAD to LAX today Seat No one answering number at LAX
negative, awaiting my return phone just would prefer to use your online option
positive, this is great news America could start flights to Hawaii by end of year via
neutral, Nice RT Vibe with the moodlight from takeoff to touchdown
positive, Moodlighting is the only way to fly Best experience EVER Cool and calming
positive, Done and done Best airline hands down
neutral, when can I book my flight to Hawaii
negative, Your chat support is not working on your
positive, View of downtown Los the Hollywood and beyond that rain in the mountains
negative, first time flyer next week excited But I'm having a hard time getting my flights added to my Elevate account Help
neutral, plz help me win my bid upgrade for my flight
neutral, I have an unused ticket but moved to a new city where you don't fly How can I fly with you before it expires
neutral, are flights leaving Dallas for Seattle on time Feb
positive, I'm for a good you rock
neutral, DREAM
positive, wow this just blew my mind
neutral, After last night I think agree
neutral, All were entertaining
neutral, Is flight on it's way Was supposed to take off minutes ago Website still shows On Time not In Flight Thanks
positive, Julie Andrews all the way though was very impressive NO to
neutral, wish you flew out of Atlanta Soon
neutral, Julie Andrews Hands down
neutral, Will flights be leaving Dallas for LA on February
negative, hi i'm so excited about your but i've been trying book since last week the page never loads thx
positive, you know it Need it on my spotify stat
positive, I'm Lady Gaga She is amazing
neutral, Carrie
neutral, New marketing song let us know what you think
neutral, Julie Andrews first but Lady Gaga wow'd me last night Carrie Meh
negative, I called a weeks ago about adding flights from to my Elevatethey still haven't shown uphelp
neutral, all are great but I have to go with
neutral, Mary Martin had it first
positive, love all three but you really can't beat the classics
neutral, Flight DAL to DCA Tried to check in could not Status please
negative, heyyyy guyyyys been trying to get through for an hour can someone call me please
negative, Virgin I'm on hold for minutes are there any earlier flights from LA to NYC earlier than
positive, Congrats on winning the award for Best Deals from an Airline
negative, everything was fine until you lost my bag
neutral, Need to change reservation Have Virgin credit card Do I need to modify on phone to waive change fee Or can I do online
neutral, I emailed your customer service team Let me know if you need the tracking number
neutral, hi I just booked a flight but need to add how can I do this
negative, your airline is awesome but your lax loft needs to step up its game for dirty tables and floors
positive, not it's been a great ride in a new plane with great crew All airlines should be like this
positive, awesome I flew yall Sat morning Any way we can correct my bill
neutral, Or watch some of the best student films in the country at feet
neutral, first time flying you all do you have a different for media Bags Thanks
negative, what is going on with customer service Is there anyway to speak to a human asap Thank you
neutral, what happened to Doom
negative, why can't you supp the biz traveler like and have customer service like
positive, I've applied more then once to be a member of the crew teamIm interested
negative, you're the best Whenever I use any other airline I'm delayed and Late Flight
negative, I have no interesting flying with you after this I will Cancelled Flight my next four flights I
negative, it was a disappointing experience which will be shared with every business traveler I meet
negative, having trouble adding this flight my wife booked to my Elevate account Help
neutral, Can't bring up my reservation online using Flight Booking Problems code
neutral, Random what's the distribution of elevate avatars I bet that kitty has a disproportionate share
neutral, I Flying VA But Life happens and I am trying to my trip JPERHI Can you helpVA home page will not let me
negative, Why is the site down When will it be back up
neutral, You down with RNP Yeah you know me
neutral, i did not get points on my elevate account for my most recent how do i add the flight and points to my account
negative, I like the TV and interesting video  Just disappointed in Cancelled Flightled flight when other flights went out to jfk on Saturday
negative, just landed in an hour after I should of been here Your no Late Flight bag check is not business travel friendly
neutral, why is flight redirected
negative, Is it or is your website down your new website isn't a great user experience Time for another redesign
negative, I can't check in or add a bag Your website isn't working I've tried both desktop and mobile
negative, Let scanned in passengers leave the plane than told someone to remove their bag from class bin
negative, What is your phone number I can't find who to call about a flight reservation
negative, is anyone doing anything there today Website is useless and no one is answering the phone
neutral, trying to add my boy Prince to my ressie SF this Thursday from LAX
negative, why must a traveler miss a flight to Late Flight check a bag I missed my morning appointments and you lost my business
neutral, check out new music
negative, how's a direct flight have unexpected layover in Vegas fuel yet peeps next to me bought for Vegas flight
negative, your no Late Flight bag check just lost you my business I missed flight and AM apt Three other people on flight had same exp
positive, amazing customer again RaeAnn in SF she's the best
negative, called your service line and was hung up on This is awesome
negative, your site is tripping I'm trying to check in and I'm getting the plain text version I am reluctant to enter any card info
neutral, I was scheduled for SFO DAL flight today Changed to due weather Looks like flight still on
positive, has getaway deals through from Lots of cool cities
neutral, has getaway deals through from Lots of cool cities
positive, has getaway deals through from Lots of cool cities
neutral, has getaway deals through from Lots of cool cities
positive, Have a great week
positive, come back to already We need you to take us out of this horrible cold
negative, should I be concerned that I am about to fly on a plane that needs to be delayed due to a tech stop
positive, is the best airline I have flown onEasy to change your representatives a comfortable flying experience
positive, and again Another rep kicked butt Naelah represents your team so beautifully Thank you
positive, your beautiful design is down right but it was cool to still book my ticket all your was secure
positive, Love the team running Gate at LAS tonight Waited for a delayed and they kept things entertaining
negative, Use another browser a brand with a reputation built on tech response doesn't have a compatible website
negative, And now the flight Flight Booking Problems site is totally down what is the problem
negative, I like the customer service but a min delay just for connecting passengers seems too long
positive, thanks to your outstanding crew who moved mountains to get me home to San Francisco tonight
positive, you have the absolute best team and customer service ever Every time I fly with you I'm delighted Thank you
neutral, Do you provide complimentary upgrades to first if there are available seats
negative, i need to change my flight thats scheduled in hours and min wait time on phone Im calling intern Help
positive, completely awesome experience last month nonstop Thanks for such an awesome flight and depart time
neutral, How can I watch the on my flight
neutral, is flight Cancelled Flightled and what do I do if it is
negative, you are failing your customers because your check in process does not link to TSA
negative, us too Terrible airline Just gave us a hotel hotline number and said sorry
neutral, has flight number from SFO to Cabo San Lucas arrived yet
negative, your assistance yesterday when u Cancelled Flightled our flight was to give us a hotel hotline Shame on you
negative, Another delayed flight
negative, I need to register a service dog for a first class ticket from SFO Dulles The phone queue is an hour or longer Pls advise
positive, you ROCK for making it so I can watch on my flight
neutral, dropped a track on you
positive, always Xoxo
negative, why can't we book seats on your flights when we buy them or even during check in Creates so much anxiety
negative, You'd think paying an extra bucks RT for luggage might afford you hiring an extra hand at
positive, best customer service rep in the world takes the cake
neutral, Can you find us a flt out of LAX that is sooner than midnight on Monday That would be great customer service
negative, please provide status for flight I cant imagine it's on time as the Web indicates dude to weather here Dallas
positive, you have amazing staff super helpful as I just ran the they have spoiled me with comfort
negative, I paid the premium to fly you across the you Cancelled Flight my flight and offer no check fee or upgrade love Sad face
negative, is it not possible to book a seat for an infant under It's not giving me the option but we want a seat for him
positive, Always have it together You're welcome RT You're so welcome
positive, home to in' back to
negative, I don't understand why you need a DM to give me an answer on if you have a damaged luggage policy
negative, does that mean you don't have a policy for destroyed luggage
neutral, is there special assistance if I travel alone kids and infant Priority boarding
positive, thank you for checking in tickets are purchased and customer is happy
neutral, is your website ever coming back online
neutral, Is Flight from Love Field to SFO definitely Cancelled Flightled for February
neutral, Is flight out of LGA to DFW on time
neutral, my drivers license is expired by a little over a month Can I fly Friday morning using my expired license
negative, having problems Flight Booking Problems on the web site keeps giving me an error and to contact by phone phone is minute wait
negative, How do I reschedule my Cancelled Flightled flights online The change button is greyed out
negative, I but there is a wait for minutes I can book the same ticket through a fix your site
negative, got a flight were for my email and its for TOMORROW This is unacceptable
negative, our flight into lga was Cancelled Flighted We're stuck in Dallas I called to told I could get a flight for
negative, why don't any of the pairings include red wine Only white is offered
negative, is the website down
negative, Your site seems a little wonked right now May want to have a look Tried on two browsers No CSS
negative, I'm disappointed that the agent at the designated silver status check in line closed to assist all pasengers
neutral, Plans to Include Austin to its Dallas Route TopNews Arab
negative, Is it normal to receive no reply from Central Baggage
negative, at Logan airport and waiting to checkin for my flight Checkin desk not open  Why
neutral, to jump into the market
neutral, Beats EPS Takes On VA LUV Investor's Business Daily
neutral, Lister to my show my on Monday
neutral, to begin in April KETR
negative, you just got all my business from EWR to Fuck you was the clincher
negative, I applied over weeks ago Haven't heard back and I'm flying this week
neutral, I'd love to know what your policy is for damaged luggage
positive, Thank you for the follow
negative, too many apologies You r the worse airlines Don't even respond to your cudtomers
negative, shame on VA for making people spend money in stranded cities when other airlines are landing at JFK Who will reimburse me
neutral, I DM you
neutral, can you please have flights in SJC  I have no choice but to fly Southwest to Vegas
negative, too bad you say it takes to days via YOUR confirmation email When I inquired after weeks you claim to weeks
negative, Flight from BOS LAS tomorrow was Cancelled Flightled No wait times are hour Will you rebook on another airline
positive, RT met your match Got status on another airline Upgrade
positive, Only way to fly
neutral, If only you guys had flights from CMH
negative, a lot of apologies being thrown out to customers from what I can seeVery sad Thanks for nothing Worst airline ever
negative, for all my flight stuff wrong and did nothing about it Had ever
neutral, Having an issue finding a missing item on a plane Can you help me find which airport my plane headed to next
positive, you will match my status Cool
neutral, met your matchGot status on another airline Upgrade
negative, trying to book a flight with you guys and your website won't let me about to lose my business
negative, you suck
positive, thanks
negative, Just DM'd Same issue persisting
negative, Because we never rec'd Cancelled Flightlation notice we were left w no options to fly out of PS Driving to LA for a red eye Mon w kids
negative, trying to book a flight your site is down
negative, You have any flights flying into Boston tomorrow I need to be home and you Cancelled Flightled my flight and didn't do anything
negative, you stink Flight Cancelled Flighted from PSP to JFK and no notification or ability to rebook better
positive, I love your guy's song We're dancing to it for our high school dance revue
negative, Your website is down and I'm trying to check in
positive, done Thank you for the quick apparently faster than sitting on hold
neutral, nervous about my flight from DC to LAX getting Cancelled Flightled tomorrow Just sent you a DM to help me
positive, cool picture of another VirginAmerica plane off our wing What a site
positive, Keep up the great work
positive, my goodness your people field are amazing under pressure Texas in crisis Please fly me to NY
positive, Thanks for a great flight from LA to Boston Pilots did a great job landing in the snow Can we go back to LA now
neutral, can you please get me to the new york area before monday afternoon
positive, Thanks so much for the awesome you guys rock
negative, seats in Row don't recline should mention that on your website
negative, flight delayed hours in LA due to mechanical problems Handle like pros but you could have tossed us a free drink
negative, why Cancelled Flight flights today No precipitation to be scared of
positive, twitter team you guys killed it for rescheduling me asap thank you
negative, You guys charged me to reschedule a flight that was then Cancelled Flighted and are now refusing to refund it What's the deal
negative, access your website from Safari on iPhone Seems to work on Mac and iPad Need iPhone to add Passbook
neutral, on iPad and clicking the CHECKIN link in the email I received at before flight
negative, your mobile site is shows won't let me checkin
negative, I was really looking forward to my flight can you let me know when it will be rescheduled
negative, why Cancelled Flight flight One sec its on my to the next its Cancelled FlightledGonna email or call me to reschedule
negative, I did it but there was a problem in the link from the email for thanks
negative, had to change to another airline to get to DC today  Why is able to land in DC but not you Cost me ugh
negative, I was so looking forward to my first flight with you today but it was Cancelled Flightled along with the subsequent one
positive, when are you putting some great deals from PDX to LAS or from LAS to PDX show me your love
positive, wish I can afford to fly with you next Friday going back home love everything about your airline
negative, how are you gonna have a deal from Dallas to DC but no deal from DC to Dallas
neutral, just a bug guys
negative, hold times at call center are a bit much
positive, Like
negative, Site down
positive, You have the best flight attendant ever
positive, Awesome RT Watch nominated films at feet
positive, thanks so much
negative, Trying to reset my email never arrives Help
positive, the only airline based in Silicon Valley
positive, Very nicely done
positive, looking forward to watching the Oscars on my flight home tomorrow I might even get something bubbly to drink
negative, What is the reason for the delay of the departure of VX from JFK this afternoon
negative, is todays flight from Palm Ca to JFK in NY Cancelled Flightled
positive, hahaha YOU GUYS ARE AMAZING I LOVE YOU
positive, sounds like fun
neutral, any updates on flight from Jfk Lax
neutral, spruce moose
negative, the CSS on your site is a right please fix Site unusable
negative, We're on flight Vegas to Boston checked in online but our bag count didn't register Can I fix that somehow
positive, luv Virgin America Greetingz
negative, I'm trying to do but the website is not working I tried different browsers and the problem continues
positive, Thanks for your great customer service today for helping me get all my travel sorted out
positive, thanks guys Sweet route over the Rockies
positive, love the music blasting at gate in while waiting for flight to Only if I could get an iced coffee
negative, the passenger in Flt that assaulted me shouldn't have flown I trust he's banned Crew filed report to
negative, current bug on website shows departure when selecting destination city
negative, luggage was severely wheel coming off baggage claim in SAN Luggage agent Miranda wasn't any help
positive, thank you for the easy itinerary shift for impending weather painless free
neutral, If you'd love to see more girls be inspired to become RT our free WOAW event March at ABQ
positive, Thanks Good times there and back the entire
neutral, beats shares take off Santa Cruz Sentinel
neutral, any plans to start flying direct from DAL to LAS
neutral, BIG weRin
positive, you're doing a great job adding little that improve the air travel experience Thank you Keep it up
negative, requested window seat and confirmed window but got stuck in middle seat Not a good way to treat silver
neutral, Grand Budapest Hotel
neutral, This is what you missed Next trip to the
negative, I paid for direct flight on purpose not to have to stop for fuel exhausted frequent flier and nothing for inconvenience
negative, there is something wrong with you website in Safari iPhone
positive, thanks for gate checking my baggage on your full flight and giving me early boarding too
negative, Already checked in so the page expired
negative, Boo for a not refunding a seat upgrade fee I did not want to buy in the first place
neutral, shares rise on financial results USA TODAY
neutral, Adds Pillows Instead of Seats in First Class Arms Race
positive, I see what you did there
neutral, way to take advantage of
neutral, you know I'm flying virgin for the fight
positive, your inflight team makes the experience
positive, cutest salt and pepper shaker ever Just when I think you guys can't get any better you just do
negative, moved my seat with no notice Better seat is cabin select not behind the row I
neutral, shares up on results
positive, fav airline
positive, we have a hot female pilot Sweet DCA to SFO
neutral, When are you guys going to start flying to Paris You're
neutral, what is your policy on flying after surgery I am still waiting for answer so I can tell me doctor
negative, already contacted Central Baggage sent DM is charging me for the dress that was in the lost suitcase
positive, Thank you
negative, Is there anything going on with the website I've been getting a lot of errors past minutes
neutral, I think i left something on the plane yesterday who do i callah
neutral, I need you to follow back in order to DM
neutral, Need to start flying to
neutral, they told to check with the airline regulation first so that is why I contacted you
negative, I have just checked in flight to SFO from LAX been told as Atlantic Flying Club Gold I get no benefits
negative, husband and I ordered three drinks via my screen and they never came Awesome
negative, soooo are you guys going to leave the seatbelt light on all flight You can barely call this turbulence
neutral, what is your policy on flying after surgery
neutral, posts second consecutive net profit
negative, Funny your website is you have missing javascript and stylesheets on the checkin process I dislike this
positive, would love to do more for virgin just like I do for
neutral, Results Handily Exceed Forecasts
neutral, I applied for a position in I was wondering if you guys received my application
neutral, achieves a second year of profitability despite revenue pressure
neutral, gives positive but sees increased competition
negative, I'm trying to check into my CT flight tmm on the desktop website and it's not working sort of caching SOS
neutral, weather delays next few weeks
neutral, check the website before you go to the airport
negative, Do you guys know your links from emails are broken
neutral, pilot says we expect a choppy landing in NYC due to some gusty winds temperature of about degrees windchill
positive, loved it Can't wait for Monday's return flight Mostly just to watch the inflight safety video again
negative, lost my luggage days ago on flight VX from LAX to IAD I'm calling every no responsePlease give me back my stuff
negative, The Flight Booking Problems section of your website seems to be broken on Chrome Might wanna look into that
positive, Hi Just wanted to see if you have any new routes planned this year for Newark Love flying you guys and hope to do so more
positive, I mean Probably inappropriate while on board it's on
positive, happy to spend the day together Let's do this
neutral, is saving my sanity right
neutral, missed my flight How does standby work
positive, They were very understanding and helped me out Thx
neutral, brought it all the way across the country today I see
positive, thank you I absolutely will
negative, Looks like a broken link for your assets
neutral, are you ready Let's say it together 'Noooo turbulence today'
negative, the manage itinerary section of your website seems to be broken for me
negative, can't check your site looks like this every time it loads
neutral, can u help this needs urgent treatment old battling cancer could u help with flights
neutral, may start service to Hawaii from this year
negative, Other carriers are less than half price for a round trip fare I am stunned
negative, WTF is happening in PDX Late Flight March such that one way from SFO is
neutral, add DTW and I'm sold
positive, How about some free drinks on the flight back for the free promo
positive, thanks
neutral, momma I made it
neutral, please contact me about portfolio left on flight VX from JFK to SFO tonite seat Need it returned Call
neutral, help I was On Flight from JKF tonight seat left portfolio Need it back
neutral, Seattle bound Wifey got me the duffle for vday She's a keeper Holla
negative, my luggage is gone I've filed my promised a Still no resolution or response from central luggage
neutral, Debbie Baldwin gave a performance of the safety demo this evening on
positive, Thanks
positive, thanks for taking care of on her flight
positive, Thanks for the lovely soft views to
negative, I requested a mileage challenge for status several weeks ago online but haven't heard back How do I get help with this
negative, Just trying to book tickets to NYC and facing super fun broken styling Don't I'll keep trying
neutral, Many Thanks for the Follow Looking for Any
neutral, Lofty View
